{
  "schema_version": "1.1.0",
  "core": {
    "core_version": "0.2.0",
    "core_content_hash": "sha256:7ec59090e3196b225ca2d68bc76cb6703b867f259f87e9d9e2bcafce896bf6ca"
  },
  "report": {
    "campaign_id": "synthetic-demo-001",
    "created_at": "2026-07-09T00:00:00Z",
    "provenance": "synthetic",
    "statistics": {
      "capability": {
        "incumbent": {
          "successes": 4,
          "trials": 6,
          "rate": 0.6666666666666666,
          "wilson": {
            "low": 0.29998832134152864,
            "high": 0.9032306674407831,
            "confidence": 0.95
          }
        },
        "candidate": {
          "successes": 5,
          "trials": 6,
          "rate": 0.8333333333333334,
          "wilson": {
            "low": 0.43649056343635395,
            "high": 0.9699474141282697,
            "confidence": 0.95
          }
        }
      },
      "paired_delta": {
        "point_estimate": 0.16666666666666666,
        "ci": {
          "low": 0.0,
          "high": 0.6666666666666666,
          "confidence": 0.95
        },
        "bootstrap": {
          "seed": 12345,
          "iterations": 2000,
          "alpha": 0.05
        }
      },
      "enhanced_estimators": {
        "two_stage_bootstrap": {
          "label": "enhanced:two-stage-bootstrap",
          "estimate": 0.16666666666666666,
          "ci": {
            "low": 0.0,
            "high": 0.6666666666666666,
            "confidence": 0.95
          },
          "bootstrap": {
            "seed": 12345,
            "iterations": 2000,
            "alpha": 0.05
          }
        },
        "wilcoxon_signed_rank": {
          "label": "enhanced:wilcoxon-signed-rank",
          "status": "reported",
          "statistic": 0.0,
          "p_value": 1.0,
          "n": 1
        },
        "glmm": {
          "label": "enhanced:glmm-logistic",
          "status": "optional-dependency-missing",
          "formula": null,
          "backend": null
        }
      }
    },
    "decision": {
      "rule": "bootstrap_ci_low_gt_margin",
      "margin": 0.1,
      "promote": false,
      "label": "enforcing:superiority-by-margin",
      "reason": "The point estimate clears the margin, but the two-stage bootstrap lower bound is not strictly above the margin.",
      "sign_test": {
        "wins": 1,
        "losses": 0,
        "ties": 2,
        "p_value": 1.0,
        "alternative": "two-sided",
        "reported_only": true
      }
    }
  },
  "raw_outcomes": [
    {
      "task_id": "synthetic-small-edit-001",
      "task_class": "small_edit",
      "must_not_break": true,
      "replicates": [
        {
          "replicate": 1,
          "incumbent": {
            "success": 1,
            "latency_ms": 1200,
            "cost": 0.0,
            "status": "succeeded"
          },
          "candidate": {
            "success": 1,
            "latency_ms": 1180,
            "cost": 0.0,
            "status": "succeeded"
          }
        },
        {
          "replicate": 2,
          "incumbent": {
            "success": 1,
            "latency_ms": 1240,
            "cost": 0.0,
            "status": "succeeded"
          },
          "candidate": {
            "success": 1,
            "latency_ms": 1195,
            "cost": 0.0,
            "status": "succeeded"
          }
        }
      ]
    },
    {
      "task_id": "synthetic-refactor-001",
      "task_class": "multi_file_refactor",
      "must_not_break": false,
      "replicates": [
        {
          "replicate": 1,
          "incumbent": {
            "success": 0,
            "latency_ms": null,
            "cost": 0.0,
            "status": "failed"
          },
          "candidate": {
            "success": 1,
            "latency_ms": 2100,
            "cost": 0.0,
            "status": "succeeded"
          }
        },
        {
          "replicate": 2,
          "incumbent": {
            "success": 1,
            "latency_ms": 2300,
            "cost": 0.0,
            "status": "succeeded"
          },
          "candidate": {
            "success": 1,
            "latency_ms": 2180,
            "cost": 0.0,
            "status": "succeeded"
          }
        }
      ]
    },
    {
      "task_id": "synthetic-fix-test-001",
      "task_class": "fix_failing_test",
      "must_not_break": true,
      "replicates": [
        {
          "replicate": 1,
          "incumbent": {
            "success": 1,
            "latency_ms": 1540,
            "cost": 0.0,
            "status": "succeeded"
          },
          "candidate": {
            "success": 1,
            "latency_ms": 1490,
            "cost": 0.0,
            "status": "succeeded"
          }
        },
        {
          "replicate": 2,
          "incumbent": {
            "success": 0,
            "latency_ms": null,
            "cost": 0.0,
            "status": "failed"
          },
          "candidate": {
            "success": 0,
            "latency_ms": null,
            "cost": 0.0,
            "status": "failed"
          }
        }
      ]
    }
  ],
  "manifest": {
    "identity_domain": {
      "status": "matched",
      "identity_domain_sha256": "sha256:174b6b7acf10e667605d2d4cf144e540ed61e020df9f2907ca089342ba72e462",
      "candidate_identity_domain_sha256": "sha256:174b6b7acf10e667605d2d4cf144e540ed61e020df9f2907ca089342ba72e462",
      "incumbent_identity_domain_sha256": "sha256:174b6b7acf10e667605d2d4cf144e540ed61e020df9f2907ca089342ba72e462",
      "observed_identity_domain_sha256s": [
        "sha256:174b6b7acf10e667605d2d4cf144e540ed61e020df9f2907ca089342ba72e462"
      ],
      "bridge_authorization": null,
      "reason": "synthetic campaign: all runs share the single synthetic identity domain published as the conformance vector"
    },
    "seeds": {
      "bootstrap": 12345,
      "power_simulation": 12345
    },
    "task_set": {
      "task_set_hash": "sha256:aaaaaaaaaaaaaaaaaaaaaaaaaaaaaaaaaaaaaaaaaaaaaaaaaaaaaaaaaaaaaaaa",
      "task_count": 3,
      "replicates_per_task": 2,
      "fixture_policy": "synthetic",
      "task_classes": [
        "small_edit",
        "multi_file_refactor",
        "fix_failing_test"
      ]
    },
    "models": [
      {
        "role": "incumbent",
        "label": "incumbent-default",
        "version": "synthetic-v1",
        "quantization": "n/a"
      },
      {
        "role": "candidate",
        "label": "candidate-a",
        "version": "synthetic-v1",
        "quantization": "n/a"
      }
    ],
    "cost": {
      "currency": "USD",
      "total": 0.0,
      "basis": "synthetic local example"
    },
    "preflight": {
      "status": "passed",
      "checked_at": "2026-07-09T00:00:00Z",
      "results": [
        {
          "model_role": "incumbent",
          "resolved": true,
          "model_version": "synthetic-v1",
          "notes": "synthetic"
        },
        {
          "model_role": "candidate",
          "resolved": true,
          "model_version": "synthetic-v1",
          "notes": "synthetic"
        }
      ]
    },
    "sanitization": {
      "status": "public-safe",
      "checked": true,
      "redactions_required": false,
      "notes": "Synthetic data only."
    }
  }
}
